<?xml version="1.0" encoding="UTF-8"?>
<universite xmlns:xsi="http://www.w3.org/2001/XMLSchema-instance"
            xsi:noNamespaceSchemaLocation="universite.xsd">

    <enseignants>
        <enseignant id="E001">
            <nom>Haddad</nom>
            <prenom>Mohamed</prenom>
            <departement>Informatique</departement>
            <grade>Professeur</grade>
        </enseignant>
        <enseignant id="E002">
            <nom>Karray</nom>
            <prenom>Leila</prenom>
            <departement>Informatique</departement>
            <grade>Maître de conférences</grade>
        </enseignant>
        <enseignant id="E003">
            <nom>Bouaziz</nom>
            <prenom>Nabil</prenom>
            <departement>Mathématiques</departement>
            <grade>Professeur</grade>
        </enseignant>
        <enseignant id="E004">
            <nom>Chaabane</nom>
            <prenom>Ines</prenom>
            <departement>Gestion</departement>
            <grade>Assistant</grade>
        </enseignant>
    </enseignants>

    <cours>
        <cours-item id="C001" optionnel="false">
            <titre>Programmation Java</titre>
            <departement>Informatique</departement>
            <credits>6</credits>
            <semestre>1</semestre>
            <enseignantRef>E001</enseignantRef>
        </cours-item>
        <cours-item id="C002" optionnel="false">
            <titre>Bases de données</titre>
            <departement>Informatique</departement>
            <credits>5</credits>
            <semestre>2</semestre>
            <enseignantRef>E002</enseignantRef>
        </cours-item>
        <cours-item id="C003" optionnel="false">
            <titre>Algèbre linéaire</titre>
            <departement>Mathématiques</departement>
            <credits>4</credits>
            <semestre>1</semestre>
            <enseignantRef>E003</enseignantRef>
        </cours-item>
        <cours-item id="C004" optionnel="true">
            <titre>Technologies XML</titre>
            <departement>Informatique</departement>
            <credits>3</credits>
            <semestre>2</semestre>
            <enseignantRef>E001</enseignantRef>
        </cours-item>
        <cours-item id="C005" optionnel="true">
            <titre>Gestion de projet</titre>
            <departement>Gestion</departement>
            <credits>3</credits>
            <semestre>2</semestre>
            <enseignantRef>E004</enseignantRef>
        </cours-item>
    </cours>

    <etudiants>
        <etudiant id="S001" actif="true">
            <nom>Ben Salah</nom>
            <prenom>Amal</prenom>
            <email>amal.bensalah@univ.tn</email>
            <filiere>Génie Logiciel</filiere>
            <dateInscription>2024-09-15</dateInscription>
            <moyenne>15.50</moyenne>
        </etudiant>
        <etudiant id="S002" actif="false">
            <nom>Trabelsi</nom>
            <prenom>Karim</prenom>
            <email>karim.trabelsi@univ.tn</email>
            <filiere>Génie Logiciel</filiere>
            <dateInscription>2022-09-12</dateInscription>
            <moyenne>9.75</moyenne>
        </etudiant>
        <etudiant id="S003" actif="true">
            <nom>Gharbi</nom>
            <prenom>Sana</prenom>
            <email>sana.gharbi@univ.tn</email>
            <filiere>Mathématiques Appliquées</filiere>
            <dateInscription>2025-09-10</dateInscription>
            <moyenne>13.20</moyenne>
        </etudiant>
        <etudiant id="S004" actif="true">
            <nom>Mansouri</nom>
            <prenom>Youssef</prenom>
            <email>youssef.mansouri@univ.tn</email>
            <filiere>Gestion</filiere>
            <dateInscription>2025-09-10</dateInscription>
            <moyenne>16.80</moyenne>
        </etudiant>
    </etudiants>
</universite>
